reviewId,userName,userImage,content,score,thumbsUpCount,reviewCreatedVersion,at,replyContent,repliedAt,appVersion,processed_content,normalized_content
a0552f90-709e-44b6-ac9c-b96da49a53ec,Ruvainderen Murali,https://play-lh.googleusercontent.com/a/ACg8ocLiU4v4peF9XzzwKV5XBuZxsui9YfX2KP7imO90nFS6l1zRew=mo,Personally watching this on the TV is a better option I have experience alot of glitches in the mobile version I hope Netflix fixes these bugs,3,0,,2025-10-12 02:56:41,,,,personally watching tv better option experience alot glitches mobile version hope netflix fixes bugs,personally watching tv better option experience alot glitch mobile version hope netflix fix bug
153d98d5-c6b0-4c24-85f5-5940d7e817c0,Sandra,https://play-lh.googleusercontent.com/a/ACg8ocLUZnkUF8zrTnDCm5UAGitFcy8H43qvDB2PYMRMB8c-jOJjoQ=mo,Exhausting app never works for me.,1,0,,2025-10-12 02:52:49,,,,exhausting app never works,exhausting app never work
664d900e-28ec-46c1-afa1-47589931cd96,Ezedo Billgate,https://play-lh.googleusercontent.com/a/ACg8ocITe1zk7luP1j0T8qt0YFDQHGUfDo307vu9PH7X_pDcFmexSA=mo,Wow such a nice app that can show you alot of movies and entertainment just download it and you will enjoy this app,5,0,,2025-10-12 02:32:16,,,,wow nice app show alot movies entertainment just download will enjoy app,wow nice app show alot movie entertainment just download will enjoy app
3e758f77-5571-41d8-9d7b-6939b6bfff70,Narnette Nthiga (Mumbu`s),https://play-lh.googleusercontent.com/a/ACg8ocKnuwZFu9Z_4lRxJnM-vYQRhfCs_IySGQi8AefFVibDJyG8uBYF=mo,Excellent 👌,5,0,8.118.1 build 10 50703,2025-10-12 02:16:59,,,8.118.1 build 10 50703,excellent,excellent
5839019d-b63d-4a13-beeb-58d27151b526,Hussein Saied,https://play-lh.googleusercontent.com/a-/ALV-UjVrPyBh9XkdX7NsTjTTPthzQGQ5BOKcfCIkcoIE9MwTDQmMYN_m,"Netflix has completely lost its direction. The platform used to have quality shows, but now it’s full of unnecessary content and poor decisions. I’ve canceled my subscription because it no longer represents what many viewers want to see.",1,0,8.58.0 build 8 50362,2025-10-12 01:55:44,,,8.58.0 build 8 50362,netflix completely lost direction platform used quality shows now full unnecessary content poor decisions ive canceled subscription longer represents many viewers want see,netflix completely lost direction platform used quality show now full unnecessary content poor decision ive canceled subscription longer represents many viewer want see
c9f3e894-2d19-466d-9a89-bf2920b15d70,Isak Hvarfner,https://play-lh.googleusercontent.com/a-/ALV-UjX1WwHWgwXCHxl_vmzdVZ2YgqJoecq4ganMMNVJZDkJHV-1gcPPkQ,Let me use the thing I pay an exorbitant amount of money for please.,1,0,9.37.0 build 7 63508,2025-10-12 01:46:07,,,9.37.0 build 7 63508,let use thing pay exorbitant amount money please,let use thing pay exorbitant amount money please
c3f3c59b-efb9-4f66-bc91-3e76f01f4b98,Sachchida nand Upadhyay,https://play-lh.googleusercontent.com/a-/ALV-UjXLNgiTmLvrEqksaliPA0aNWnWoOcwLGMAVdTouxzwqlYzccuHP,"There is a problem playing the video. Please try again. (5.10) I am facing this problem from many days, till now no one has solved my problem, what is the benefit for me in taking Netflix subscription, please solve it.",1,1,9.37.0 build 7 63508,2025-10-12 01:36:29,,,9.37.0 build 7 63508,problem playing video please try 510 facing problem many days till now one solved problem benefit taking netflix subscription please solve,problem playing video please try 510 facing problem many day till now one solved problem benefit taking netflix subscription please solve
4eb32ee6-0d2f-4c83-ba11-74d935a47967,Linda Newman,https://play-lh.googleusercontent.com/a/ACg8ocJuN2U4H-ZA_J7ue6SABZxm-T1gW3TskyDWyQR_yjVUxkp4TQ=mo,if I can anyone can,5,0,8.59.1 build 12 50370,2025-10-12 01:26:49,,,8.59.1 build 12 50370,anyone,anyone
513c2e08-6eed-4701-b806-64d6f1d039e7,Nauka Shah,https://play-lh.googleusercontent.com/a/ACg8ocLUnW5AMHWI6VCXqvrw-jRZZxCyMDQdViWNvK9EooEZbMkfIw=mo,we are already paid rs. 199 for one month plan. but facing for update of payment. if paid full for one month so why you against charge from us.,2,0,9.37.0 build 7 63508,2025-10-12 01:14:52,,,9.37.0 build 7 63508,already paid rs 199 one month plan facing update payment paid full one month charge us,already paid r 199 one month plan facing update payment paid full one month charge u
5ae18a04-f6ca-4388-b49c-0d2bd0388b21,Eli Gwapos,https://play-lh.googleusercontent.com/a-/ALV-UjU3zThWkfzS4BJPmEQ--FotfLVcvCtbzmKhlA4-jxGbrlg_hLw,how do I access the games. I mean I love Netflix but y cant I access the games??,5,0,9.37.0 build 7 63508,2025-10-12 01:03:33,,,9.37.0 build 7 63508,access games mean love netflix y cant access games,access game mean love netflix y cant access game
bfdf373a-3645-42b0-9001-ed6598f59107,Mehak Sikandar,https://play-lh.googleusercontent.com/a-/ALV-UjWf7XkK_vnD5_MRI9BwZ9ObP8ioQMm-2KPJj5gkoixDQRyxSUEP,Pretty good and works well. has many options to watch specially classic movies 🎬 please Don't remove them.,5,0,,2025-10-12 01:00:25,,,,pretty good works well many options watch specially classic movies please dont remove,pretty good work well many option watch specially classic movie please dont remove
b922d9bc-de3a-484a-aa28-82fc31a66a98,madvan stark,https://play-lh.googleusercontent.com/a-/ALV-UjXLYMF0KNV5oBt2VkhS0u-MvS5JXV574fDAiZqnn6ibVGPyFvkm_w,always show server error. such a waste,1,0,,2025-10-12 00:33:58,,,,always show server error waste,always show server error waste
2be2ca29-c85a-4c5c-ae44-e395e42c3ab8,Ebad E,https://play-lh.googleusercontent.com/a/ACg8ocLnEM1IkJWnSF2mdMccZ0Y_LFM8USQr6rCXQDrwzBSR3K-1HA=mo,problem with sign in any accounts,1,0,8.26.0 build 11 40221,2025-10-12 00:11:43,,,8.26.0 build 11 40221,problem sign accounts,problem sign account
ac4accdf-3e00-4b0d-9a22-8a727e6d8f38,Peter Collins,https://play-lh.googleusercontent.com/a-/ALV-UjVuSYKeaVQEat0WymTgHhZLiQSOBo_iBj0kindrh96w2iVYHXmr,what was the point of getting the WWE content if your player constantly breaks whilst playing it?,1,1,9.37.0 build 7 63508,2025-10-12 00:05:54,,,9.37.0 build 7 63508,point getting wwe content player constantly breaks whilst playing,point getting wwe content player constantly break whilst playing
5021edeb-e70a-4c58-bb54-ac9e4a77bf2e,Tarakeshvari Tayade at,https://play-lh.googleusercontent.com/a-/ALV-UjU-5T58T1FvU8C9ghf94FJ8yTtQ070JGR1NcxrnkYMeJnArlpz6Lw,"So easy to use , and I think that it is Spectacular and Just Wonderful",5,0,9.36.0 build 7 63488,2025-10-12 00:05:11,,,9.36.0 build 7 63488,easy use think spectacular just wonderful,easy use think spectacular just wonderful
eef5c3dc-e73f-45e6-a35e-0b00ec0b3974,Mohd aslam,https://play-lh.googleusercontent.com/a/ACg8ocK5Ftcauau89QqUBgRyZpbv4ryjT9Ab7PtMdVtsIdwnrNCAuA=mo,some days before when netflix tried to promote lgbt I have cancelled my membership and still they didn't cancel my membership as they got to know alot of people have cancelled now they will loose lots of money netflix i swear even if you stop promoting the lgbt I will never ever again buy your membership and I request everyone go to banking app or indian go to upi app and cancel the automatic payment from there,1,0,9.36.0 build 7 63488,2025-10-12 00:04:12,,,9.36.0 build 7 63488,days netflix tried promote lgbt cancelled membership still didnt cancel membership got know alot people cancelled now will loose lots money netflix swear even stop promoting lgbt will never ever buy membership request everyone go banking app indian go upi app cancel automatic payment,day netflix tried promote lgbt cancelled membership still didnt cancel membership got know alot people cancelled now will loose lot money netflix swear even stop promoting lgbt will never ever buy membership request everyone go banking app indian go upi app cancel automatic payment
c2c545e3-9897-4074-8b4c-4f8e5ac8d8f7,Kubra Husaain,https://play-lh.googleusercontent.com/a/ACg8ocJTvj9iyyBrbPZ7sVc0YP87qt6gpTUE7rgrNR1Ht8sZ2jd4kQ=mo,best app ever the quality is very good 💯,5,0,9.36.0 build 7 63488,2025-10-11 23:49:23,,,9.36.0 build 7 63488,best app ever quality good,best app ever quality good
8d346c98-12b4-494b-bf5d-5a404ab3adcd,tapash Das,https://play-lh.googleusercontent.com/a-/ALV-UjWYN_SqtgdvPAQyjVvuQsPV3FweLORjCIogtu8FrA5XoKKev04,only for The blind side,5,0,,2025-10-11 23:22:50,,,,blind side,blind side
cdc7feed-2aed-45a5-9733-c1ff6ce7f9ba,Sana Sadik,https://play-lh.googleusercontent.com/a-/ALV-UjXlOl1WaEDdANgIRkD-qbWqy4RZPWZ9op0lwjoviiOgkoSaAtq4,Netflix Needs To Add BLUELOCK,4,0,9.37.0 build 7 63508,2025-10-11 23:18:37,,,9.37.0 build 7 63508,netflix needs add bluelock,netflix need add bluelock
ee9af79b-d765-4c17-96e3-132ce1ad1fa6,Akhileswar Yaddanapudi,https://play-lh.googleusercontent.com/a/ACg8ocJGsQBlRQJ2UhknKzeEI0wwcqnsSEk23XBjFghiYVdtbcKkOw=mo,there is a serious bug with automated payment system as it sometimes cant process the payment info and asks to update and repay again. lot of hassle if we want to get the amount refunded as the customer support cant access transactions to their account to verify and we have to go via bank to resolve payment dispute.,1,0,,2025-10-11 23:18:22,,,,serious bug automated payment system sometimes cant process payment info asks update repay lot hassle want get amount refunded customer support cant access transactions account verify go via bank resolve payment dispute,serious bug automated payment system sometimes cant process payment info asks update repay lot hassle want get amount refunded customer support cant access transaction account verify go via bank resolve payment dispute
432f05df-bf89-473e-8515-880336328c39,Wesley Jeffers,https://play-lh.googleusercontent.com/a-/ALV-UjVbydt_exHDVpgM9wA2DOpSSrWCQIid1tp90bd8clliCr0ZD0HJ,"i had an account for nearly a decade. I cancelled in July 2024 because they kept increasing their prices and it got to be too expensive for me. I tried logging in today and my email couldn't be found. It took me forever to find their chat, they took a long time to comprehend what I was saying, and it turns out they delete your account permanently after 10 months of inactivity. A decade of my watch history and watchlist gone without warning, no email, no notice. I won't be making a new one.",1,4,9.36.0 build 7 63488,2025-10-11 23:09:00,,,9.36.0 build 7 63488,account nearly decade cancelled july 2024 kept increasing prices got expensive tried logging today email couldnt found took forever find chat took long time comprehend saying turns delete account permanently 10 months inactivity decade watch history watchlist gone without warning email notice wont making new one,account nearly decade cancelled july 2024 kept increasing price got expensive tried logging today email couldnt found took forever find chat took long time comprehend saying turn delete account permanently 10 month inactivity decade watch history watchlist gone without warning email notice wont making new one
262083d4-360f-4d48-a7c4-2179ab6c3853,Hamza Tariq Butt,https://play-lh.googleusercontent.com/a/ACg8ocIBNP_LePXAGO_Eua49_gX-u-11USgE42tGnwyyn0ML2YRnQw=mo,"Im facing a problem, while video is running, video start crashing... blurry and double vision sounds remains normal why please help me to solve this issue",2,1,9.37.0 build 7 63508,2025-10-11 22:44:22,,,9.37.0 build 7 63508,im facing problem video running video start crashing blurry double vision sounds remains normal please help solve issue,im facing problem video running video start crashing blurry double vision sound remains normal please help solve issue
a59066d6-b9c7-44bc-949d-b9c4b0210b88,Prem Dewangan,https://play-lh.googleusercontent.com/a/ACg8ocKJKMl6IOKsFizbeRtEQtNXnLUVdf-kD7ESwWqdLavtpRnGnA=mo,bilkul bekaar aap hai login hi nhi horha hai is app ne,1,0,,2025-10-11 22:32:24,,,,bilkul bekaar aap hai login hi nhi horha hai app ne,bilkul bekaar aap hai login hi nhi horha hai app ne
b077a37e-c3c7-4864-9c47-b8e87e5db3ae,Julia,https://play-lh.googleusercontent.com/a/ACg8ocJRcTcqjNZfh5ozblHsfb2NMgfC7mnOzxG0in2RUop2oyWIEA=mo,"We have had a full subscription for over 10 years. App now regularly tells us our devices are not part of our household because they are not connected to the household WiFi....even though our devices ARE connected to the home WiFi and no other WiFi. This makes NO SENSE. Honestly, watching films was easier when you went to a store and rented a physical copy. You knew in advance how much time it would take and usually the only problem would be that they didn't have any available copies left.",1,0,8.143.5 build 19 52400,2025-10-11 22:29:19,,,8.143.5 build 19 52400,full subscription 10 years app now regularly tells us devices part household connected household wifieven though devices connected home wifi wifi makes sense honestly watching films easier went store rented physical copy knew advance much time take usually problem didnt available copies left,full subscription 10 year app now regularly tell u device part household connected household wifieven though device connected home wifi wifi make sense honestly watching film easier went store rented physical copy knew advance much time take usually problem didnt available copy left
38026965-251a-4175-a47e-3f42f6fd937a,Mycal Berkey,https://play-lh.googleusercontent.com/a-/ALV-UjXn8HUliAeRYegt1J1F8R_1paC4x4Vvm2mplm-s8yTO8JRcTwc5,i had the 7.99 plan and then all of a sudden today i was charged $27.00 dollars. netflix changed my plan themselves. the scam known as netflix is growing.,1,0,8.131.0 build 3 50829,2025-10-11 22:03:45,,,8.131.0 build 3 50829,799 plan sudden today charged 2700 dollars netflix changed plan scam known netflix growing,799 plan sudden today charged 2700 dollar netflix changed plan scam known netflix growing
f11e9df8-cfcb-4a0a-b46b-6098bc78e37a,Vianca Garcia,https://play-lh.googleusercontent.com/a/ACg8ocLNUxkYS0FOImwOJrPjEtz3cuDoVO6uhNa6ti1qEfpsklIDFw=mo,it doesn't let me create an acc it takes me back to login stupid thing,1,0,9.37.0 build 7 63508,2025-10-11 22:00:03,,,9.37.0 build 7 63508,doesnt let create acc takes back login stupid thing,doesnt let create acc take back login stupid thing
49620f0c-d148-4d83-96e4-467f592c1e8b,Velvet star night,https://play-lh.googleusercontent.com/a/ACg8ocLH_qc4BbOIBWWK7sAHAlOtRtdWreyNycuR7K00yazzzFe6Tg=mo,popcorn sath nhi diye,1,0,,2025-10-11 21:59:02,,,,popcorn sath nhi diye,popcorn sath nhi diye
3bbd79eb-bc57-48d6-8154-e8c44e0e2b9f,علي محمد,https://play-lh.googleusercontent.com/a/ACg8ocKvaK5jqB5M7LFXoafkAH-peH-0BpaKmuk-JLRmprj-LdtCxf8=mo,it's Not free,1,0,,2025-10-11 21:46:12,,,,free,free
1e8f50ec-198f-426b-b61d-76f8c2693431,Pramila,https://play-lh.googleusercontent.com/a/ACg8ocICnFiTY2FAL0xZzNuRBkRGoC8AybZmI-5j4GdCAKMkOWd0nA=mo,omg 👌 👏 😍,5,0,,2025-10-11 21:45:52,,,,omg,omg
e00f9899-1c36-4b8e-bc4a-217b2c171680,Andy Koh,https://play-lh.googleusercontent.com/a-/ALV-UjVK6IWCg2jM1v7NDzzb0j8DcjfzZgN8FNxUi_uRpSVBsQ0TmSjLeA,"Although i've downloaded the Nextflix app on my new Huawei tablet, i can't seem to download any movies....",3,1,9.37.0 build 7 63508,2025-10-11 21:45:27,,,9.37.0 build 7 63508,although ive downloaded nextflix app new huawei tablet cant seem download movies,although ive downloaded nextflix app new huawei tablet cant seem download movie
f57a28bd-f49c-43ea-8ff5-5a23e22dca90,Delroy Nyamupinga,https://play-lh.googleusercontent.com/a/ACg8ocIO7WwBUBr3Cek3e74AkjxX7L5StHGpXfyb_qdfu7_AWyidRA=mo,Game,5,0,,2025-10-11 21:33:50,,,,game,game
4da033a7-a0fe-42e8-a3b6-59b4f9bb72bc,Andy,https://play-lh.googleusercontent.com/a/ACg8ocI-ay2udbE0aISRs3x16BlJbZ6Udxhc_9QJ7OF-1b4w6FbHUI5S=mo,"Trying to manage my kids' Netflix profile was a nightmare. You can't edit child profiles in the app, and if you try on the web, it forces you back into the app—where edits are blocked. I had to use incognito mode just to bypass the redirect and access proper controls. It's absurdly convoluted for something so basic. Parents need clear, direct access—not a maze of restrictions and redirects.",1,14,9.37.0 build 7 63508,2025-10-11 21:30:23,,,9.37.0 build 7 63508,trying manage kids netflix profile nightmare cant edit child profiles app try web forces back appwhere edits blocked use incognito mode just bypass redirect access proper controls absurdly convoluted something basic parents need clear direct accessnot maze restrictions redirects,trying manage kid netflix profile nightmare cant edit child profile app try web force back appwhere edits blocked use incognito mode just bypass redirect access proper control absurdly convoluted something basic parent need clear direct accessnot maze restriction redirects
b1273853-c8e8-4ea6-bce7-4e2bfd0788cc,#Just MS,https://play-lh.googleusercontent.com/a/ACg8ocJH-_s2G8u6fnuMF7TADHNIrkOwAAo89MJlpcKCcaBQo4yZgw=mo,"There are not many Kannada movies in the app and for the ones that are there, audio is not Kannada language what is the point of this!?",3,1,9.37.0 build 7 63508,2025-10-11 20:58:34,,,9.37.0 build 7 63508,many kannada movies app ones audio kannada language point,many kannada movie app one audio kannada language point
b19d2c29-8586-4a98-9db3-036a9dda93d7,Shlok Yadav,https://play-lh.googleusercontent.com/a/ACg8ocLM88VMEU92VaGWmKgLVxKdRiiUB9B4k5tQAhevWwiCSfPhbA=mo,"it's very bad app this app is not working well ,also very slow and have account issue 😕",1,0,9.37.0 build 7 63508,2025-10-11 20:50:44,,,9.37.0 build 7 63508,bad app app working well also slow account issue,bad app app working well also slow account issue
666ac35a-ac2f-4eef-9eb6-9bc73a7ac480,Prakash Paras,https://play-lh.googleusercontent.com/a-/ALV-UjXh8Uo8WG9AgNM_Rmf-daqwfSHkmpj-CmkcrB8a0jRWDfJubm2P6g,Tv screencast black screen showing but fix this problem,1,0,,2025-10-11 20:48:46,,,,tv screencast black screen showing fix problem,tv screencast black screen showing fix problem
dbae0d43-faee-4138-85a4-74b9d93e2414,Charles Ilag,https://play-lh.googleusercontent.com/a/ACg8ocK0dE2FtTTVtRn6FOUCWyHao9HC35hsKPvJJPG3k5B-NuyEUw=mo,can't play a movie,5,0,9.37.0 build 7 63508,2025-10-11 20:46:34,,,9.37.0 build 7 63508,cant play movie,cant play movie
75bd5d8d-a3fa-4e65-bf7a-7475fe24989e,Nicola Marciniak,https://play-lh.googleusercontent.com/a-/ALV-UjUvHgCxiWCq88YmDyJTe9SB8hXAxKzPHS8lZZNU8h0V1hEtUA,"if you add Pokémon: sun and moon back, like it used to be than maybe I would've given you a 5 star, right now 4 is enough",4,0,9.37.0 build 7 63508,2025-10-11 20:45:14,,,9.37.0 build 7 63508,add pokémon sun moon back like used maybe wouldve given 5 star right now 4 enough,add pokémon sun moon back like used maybe wouldve given 5 star right now 4 enough
142829ca-4d89-487f-9824-6c9f31e9cc21,CATACUTAN Angeline,https://play-lh.googleusercontent.com/a-/ALV-UjXsj-1O5TVuxAUa78Db5v8Az1jDgT1mlDBOjP1y7y94lsnn5Vw,amazing,5,0,,2025-10-11 20:37:39,,,,amazing,amazing
3ee7322e-88c4-4c3e-b315-09bbe773555b,4bit Sam,https://play-lh.googleusercontent.com/a/ACg8ocJEP3xiZ8JQBGGWpKG4BR--GZ7mmD53uwctQjznm3M_-wLfZg=mo,hello Netflix please make battlefield or call of duty campaign games for mobile like u release WWE or gta and Raji please I want aaa fps games on my mobile phone please literally I am bored now to play these pubg free fire and cod mobile like multiplayer microtransactions games you port my dream on my phone WWE 25 and now please port battlefield or call of duty campaign please I really appreciate it,5,0,9.21.0 build 5 62896,2025-10-11 20:36:23,,,9.21.0 build 5 62896,hello netflix please make battlefield call duty campaign games mobile like u release wwe gta raji please want aaa fps games mobile phone please literally bored now play pubg free fire cod mobile like multiplayer microtransactions games port dream phone wwe 25 now please port battlefield call duty campaign please really appreciate,hello netflix please make battlefield call duty campaign game mobile like u release wwe gta raji please want aaa fps game mobile phone please literally bored now play pubg free fire cod mobile like multiplayer microtransactions game port dream phone wwe 25 now please port battlefield call duty campaign please really appreciate
0e7ff2f3-346b-4f4a-b0de-ebb0dbf515db,Kevin,https://play-lh.googleusercontent.com/a/ACg8ocIW7tGKpUePyUYARpC7DOgbpgT1uNxoLvXbnsMCqH98RqWYRg=mo,love movies this is a great place to look,5,0,9.36.0 build 7 63488,2025-10-11 20:19:01,,,9.36.0 build 7 63488,love movies great place look,love movie great place look
4511ebc7-8662-4b3c-a88f-00d70388b20a,Germina Mare,https://play-lh.googleusercontent.com/a/ACg8ocIB0D6VOmubLS42URFGwlFEXBASaZXX_I23I_dPC5aC6abRIg=mo,i like it,5,0,9.37.0 build 7 63508,2025-10-11 20:11:23,,,9.37.0 build 7 63508,like,like
c5dce032-4f49-403e-a399-00a8c28a7418,muni sekhar,https://play-lh.googleusercontent.com/a-/ALV-UjVywVAFcS9kQ62YhVTIOcX3AjgnlCwTsGMImCgQwHs-MbgdlI2W,worst,1,0,,2025-10-11 20:05:07,,,,worst,worst
45373f8e-ebbc-47d0-aa7b-756de8236c6b,Oluwakemi Odusoga,https://play-lh.googleusercontent.com/a/ACg8ocLU_jdPo9snevRdwFVqg0fJ6sStVFclVf88uNo8b1hEwnx0GQ=mo,excellent app,4,0,8.28.0 build 4 40234,2025-10-11 20:04:43,,,8.28.0 build 4 40234,excellent app,excellent app
c834ad3d-0f34-4560-9b2e-aeacc42e300c,Ann Hennessy,https://play-lh.googleusercontent.com/a-/ALV-UjV2navMS13Gs3E92NhV8rd_jeVDG3Q7aNlIXMF8hpApcuWMc04,not to bad quite easy,1,0,8.116.0 build 8 50690,2025-10-11 19:42:51,,,8.116.0 build 8 50690,bad quite easy,bad quite easy
b4f427dc-4317-491b-a400-3f649e7d0378,Precious Chizzy,https://play-lh.googleusercontent.com/a-/ALV-UjXcj1g3xhMHE63oB8ovAr5Knh4YQI26Dt3NWmVO2wswUiXDggU,I love it,5,0,,2025-10-11 19:42:36,,,,love,love
839d547d-7d94-4f57-8134-6a5baa44d806,Essance Harrison,https://play-lh.googleusercontent.com/a/ACg8ocIIQ1OWqejT8dtNOOhbAzivPBh_l_qlB4Yfowfac0CmZsif9Q=mo,Streaming live sports events and giving notifications better.,5,0,9.37.0 build 7 63508,2025-10-11 19:35:09,,,9.37.0 build 7 63508,streaming live sports events giving notifications better,streaming live sport event giving notification better
e0529ac9-736a-4780-ac17-60773f3ef50f,john carlo bitos,https://play-lh.googleusercontent.com/a-/ALV-UjXFFki5eVAsTteJcikKViizGjJtV9A3rBJV96dljUkztq2b_wPW,Its dim to my tv,4,0,9.30.1 build 8 63276,2025-10-11 19:30:04,,,9.30.1 build 8 63276,dim tv,dim tv
b491741b-313d-42f0-aa84-27c0f86e8c2e,Adithya,https://play-lh.googleusercontent.com/a/ACg8ocKF7_Ga5qsYhMER5yRiKBr3M0F2ceY7IbZVZQv1_6cO7q_m_A=mo,I'm requesting Netflix to Put Mobile number and OTP for signing up. Give that option also. please,3,0,,2025-10-11 19:15:14,,,,im requesting netflix put mobile number otp signing give option also please,im requesting netflix put mobile number otp signing give option also please
487eee8a-3d3a-4e68-85ce-c41db308b007,MAW SALAD,https://play-lh.googleusercontent.com/a-/ALV-UjW2Tf8TBC4ROreB-LuhCC-aJmmQV_yiaGFD4uexjcKZssP9-S8,"Why do you have to remove films man like bro i wanna watch Kamisama Kiss it's already removed, i wanna watch Fullmetal Alchemist Brotherhood it's already removed like can you not😭😭😭😭😭",1,0,,2025-10-11 19:15:02,,,,remove films man like bro wanna watch kamisama kiss already removed wanna watch fullmetal alchemist brotherhood already removed like,remove film man like bro wan na watch kamisama kiss already removed wan na watch fullmetal alchemist brotherhood already removed like
288d9402-3bf4-4647-b330-1bdb2cb78fa6,j d,https://play-lh.googleusercontent.com/a/ACg8ocIm1cuqYRNiXRBXp0_izeV-jtl2atm1LpvJkyMGD1Pz3s6rjQ=mo,"netflix is getting more and more greedy, I'm done with it",1,0,9.36.0 build 7 63488,2025-10-11 18:08:39,,,9.36.0 build 7 63488,netflix getting greedy im done,netflix getting greedy im done
a0b96db0-acbc-4cb0-bb6d-b4f523cf65f1,Zaitwa Nanjere,https://play-lh.googleusercontent.com/a/ACg8ocIQfNCxIqevXvuUnPVA2DIzSdbkRa1e_PmxGy3p3flirmCa0w=mo,Cool 😎,5,0,,2025-10-11 17:57:58,,,,cool,cool
10c33aac-aa79-4456-bd6a-5f206dd9127a,Vinuka Dilruwan,https://play-lh.googleusercontent.com/a/ACg8ocJ3Dee5dT96XUbuMxb2_DmM6QI8X1ZUSeGUtr-Xf91A91CUZA=mo,great and nice,5,0,,2025-10-11 17:48:46,,,,great nice,great nice
d3691105-a136-45b8-8480-d99b77ac3b79,Barnali P,https://play-lh.googleusercontent.com/a/ACg8ocJICBdGZB9Y5OBMX2KoBWqwyoCuZYY1lDScJS3qM4Ms9r7JfA=mo,after paying this much money i cannot even watch my drama in peace the subtitles is not matching the scenes i have tried every possible way to fix it. shame on you guys,1,0,,2025-10-11 17:48:13,,,,paying much money even watch drama peace subtitles matching scenes tried every possible way fix shame guys,paying much money even watch drama peace subtitle matching scene tried every possible way fix shame guy
162d8977-7df4-45c5-a30c-e4e2f1191c2d,Allen Lobo,https://play-lh.googleusercontent.com/a-/ALV-UjW9EBimk1EkbhAGpzFMeGG2oodjfoepHj4fS-lo9unuO-rQHwoI,Best OTT Platform,5,0,8.17.0 build 6 40147,2025-10-11 17:02:27,,,8.17.0 build 6 40147,best ott platform,best ott platform
3d44b430-e655-4ea5-954d-eccf81967575,Drew Yabuki,https://play-lh.googleusercontent.com/a/ACg8ocJaSGS8c1ABevsTdYlCNgU4H3OOXwAtPbdpbgpPGWOubuR0EQ=mo,"real good but still needs some sorting in the downloads like a letters or arrange them in ""ABC"" kind to arrange the downloads letter by letter and a site where to wach a nice movie at night to 👍",5,1,9.36.0 build 7 63488,2025-10-11 16:43:42,,,9.36.0 build 7 63488,real good still needs sorting downloads like letters arrange abc kind arrange downloads letter letter site wach nice movie night,real good still need sorting downloads like letter arrange abc kind arrange downloads letter letter site wach nice movie night
